PMID,Publication_Title
36762555,Retraction: MiR-942 regulates the function of breast cancer cell by targeting FOXA2.
36762554,"Cyclopropenone, Cyclopropeniminium Ion, and Cyclopropenethione as Novel Electrophilic Warheads for Potential Target Discovery of Triple-Negative Breast Cancer."
36762500,"Sq-2, a biotinylated annonaceous acetogenin, induces apoptosis, autophagy and S-phase arrest by activating the MAPK pathway in breast cancer cells."
36762416,Ribociclib-induced hepatotoxicity.
36762395,Overcoming barriers: Modelling the effect of potential future changes of organized breast cancer screening in Italy.
36762368,Prenatal Origins of Endometriosis Pathology and Pain: Reviewing the Evidence of a Role for Low Testosterone.
36762329,HER2/positive and HER2/low in inflammatory breast cancer recurrence.
36761974,Editorial: Rising stars in molecular and cellular oncology 2022.
36761973,More recent insights into the breast cancer burden across BRICS-Plus: Health consequences in key nations with emerging economies using the global burden of disease study 2019.
36761969,Designing home-based physical activity programs for rural cancer survivors: A survey of technology access and preferences.
36761968,Molecular subtypes predict the preferential site of distant metastasis in advanced breast cancer: a nationwide retrospective study.
36761956,Relationship between polymorphisms in homologous recombination repair genes RAD51 G172T XRCC2 & XRCC3 and risk of breast cancer: A meta-analysis.
36761942,Emerging functions of C/EBPbeta in breast cancer.
36761762,Human antibodies targeting ENPP1 as candidate therapeutics for cancers.
36761757,Bright future or blind alley? CAR-T cell therapy for solid tumors.
36761753,Identification and validation of a novel senescence-related biomarker for thyroid cancer to predict the prognosis and immunotherapy.
36761696,An Magnetic-Targeting Nano-Diagnosis and Treatment Platform for TNBC.
36761482,Diagnostic accuracy of contrast-enhanced ultrasound synchronized with shear wave elastography in the differential diagnosis of benign and malignant breast lesions: a diagnostic test.
36761429,Breast metastasis from endometrial clear cell carcinoma: A case report and review of the literature.
36761428,LAG-3+ tumor-infiltrating lymphocytes ameliorates overall survival in triple-negative breast cancer patients.
36761415,Real-life analysis of neoadjuvant-therapy-associated benefits for pathological complete response and survival in early breast cancer patients - role of trastuzumab in HER2+ BC and platinum in TNBC.
36761387,Real-world effect of bevacizumab and eribulin on metastatic breast cancer using a propensity score matching analysis.
36761385,Circulating cervical cancer biomarkers potentially useful in medical attention (Review).
36761373,Axillary chest wall solid-papillary carcinoma: A case report on presentation and management.
36761298,Evaluation of probe-based ultra-sensitive detection of miRNA using a single-molecule fluorescence imaging method: miR-126 used as the model.
36761256,Periodic-net: an end-to-end data driven framework for diffuse optical imaging of breast cancer from noisy boundary data.
36761036,E pluribus unum: prospective acceptability benchmarking from the Contouring Collaborative for Consensus in Radiation Oncology crowdsourced initiative for multiobserver segmentation.
36760835,Ensemble Learning-Based Hybrid Segmentation of Mammographic Images for Breast Cancer Risk Prediction Using Fuzzy C-Means and CNN Model.
36760569,Higher risk of cardiovascular mortality than cancer mortality among long-term cancer survivors.
36760387,Hypermethylated WASF2: tumor suppressive role in head and neck squamous cell carcinoma.
36760385,Clusterin is a biomarker of breast cancer prognosis and correlated with immune microenvironment.
36760370,Expression and clinical significance of undifferentiated embryonic cell transcription factor 1 in breast cancer.
36760343,Targeting Education as a Barrier to Implement Hypofractionation: Results of a Country-Wide Training Program.
36760296,Deep learning assisted holography microscopy for in-flow enumeration of tumor cells in blood.
36760255,The role of sacituzumab govitecan in hormone receptor-positive/human epidermal growth factor receptor 2-negative metastatic breast cancer.
36760254,Elevated ADAM-like Decysin-1 (ADAMDEC1) expression is associated with increased chemo-sensitivity and improved prognosis in breast cancer patients.
36760158,Vitiligo-like lesions associated with ribociclib in a woman with metastatic breast cancer.
36760039,What's the reality for CDK4/6 inhibitors: Clinical trials or real-world evidence?
36760031,Overall survival associated with CDK4/6 inhibitors in patients with HR+/HER2- metastatic breast cancer in the United States: A SEER-Medicare population-based study.
36760012,Self-assessment of a breast care nursing model within a Breast Unit: learning process and keys to improving breast care.
36760007,Prostate-Specific Antigen and Female Breast Cancer-Revisited.
36759991,[Five Cases of Breast Cancer Developed after Silicone Breast Implant].
36759982,[Challenges to International Collaborative Clinical Research and Approval Disparities].
36759846,Study on the correlation between B vitamins and breast cancer.
36759845,Evaluating the psychometric properties of the Persian version of the Healthy Lifestyle Instrument for Breast Cancer Survivors (HLI-BCS).
36759828,Inhibition of MMPs supports amoeboid angiogenesis hampering VEGF-targeted therapies via MLC and ERK 1/2 signaling.
36759799,Melatonin and 5-fluorouracil combination chemotherapy: opportunities and efficacy in cancer therapy.
36759786,Preparation of chitosan nanoparticle containing recombinant CD44v antigen and evaluation of its immunization capacity against breast cancer in BALB/c mice.
36759733,A reversible SRC-relayed COX2 inflammatory program drives resistance to BRAF and EGFR inhibition in BRAFV600E colorectal tumors.
36759723,The oncogenic roles and clinical implications of YAP/TAZ in breast cancer.
36759673,Oncolytic T-VEC virotherapy plus neoadjuvant chemotherapy in nonmetastatic triple-negative breast cancer: a phase 2 trial.
36759576,Correction to: A combination of novel NSC small molecule inhibitor along with doxorubicin inhibits proliferation of triple-negative breast cancer through metabolic reprogramming.
36759573,Correction: Proliferation-associated Brn-3b transcription factor can activate cyclin D1 expression in neuroblastoma and breast cancer cells.
36759550,Author Correction: Integrated approach for studying bioactive compounds from Cladosporium spp. against estrogen receptor alpha as breast cancer drug target.
36759501,Novel roles of RNA-binding proteins in drug resistance of breast cancer: from molecular biology to targeting therapeutics.
36759314,Breast reconstruction with combined large omentum and prosthesis after breast cancer surgery: A case report.
36759253,Rates of reoperation after breast conserving cancer surgery in Western Australia before and after publication of the SSO-ASTRO margins guideline.
36759216,[2022: New therapeutic practices in breast oncology].
36759122,An 80-Year-Old Woman With Dyspnea and a Lung Mass.
36759097,"Breast Cancer: Risk Assessment, Screening, and Primary Prevention."
36759039,Adenoid cystic carcinoma of the breast with late recurrence and high-grade transformation.
36758843,Prognosis-related metabolic genes in the development of colorectal cancer progress and perspective.
36758833,High-throughput method to analyze the cytotoxicity of CAR-T Cells in a 3D tumor spheroid model using image cytometry.
36758816,Mixed exposure to phthalates and organic UV filters affects Children's pubertal development in a gender-specific manner.
36758785,Ganoderma lucidum extract-mediated gasdermin E cleavage promotes tumor cell pyroptosis and inhibits metastasis in breast cancer.
36758771,Preparation of hyaluronic acid-loaded Harmine polymeric micelles and in vitro effect anti-breast cancer.
36758499,Homologous recombination deficiency prediction using low-pass whole genome sequencing in breast cancer.
36758448,Decision regret in breast cancer patients after adjuvant radiotherapy.
36758421,Impact of preoperative brachytherapy followed by radical hysterectomy in stage IB2 (FIGO 2018) cervical cancer: An analysis of SENTICOL I-II trials.
36758380,Analysis of radiomic features derived from post-contrast T1-weighted images and apparent diffusion coefficient (ADC) maps for breast lesion evaluation: A retrospective study.
36758326,Compatible-domain Transfer Learning for Breast Cancer Classification with Limited Annotated Data.
36758322,Adherence Disparities and Utilization Trends of Oncotype DX Assay: A National Cancer Database Study.
36758150,Integrated SERS-Vertical Flow Biosensor Enabling Multiplexed Quantitative Profiling of Serological Exosomal Proteins in Patients for Accurate Breast Cancer Subtyping.
36758146,Single-Cell Analysis of Unidirectional Migration of Glioblastoma Cells Using a Fiber-Based Scaffold.
36758048,Mitochondrial genome in sporadic breast cancer: A case control study and a proteomic analysis in a Sinhalese cohort from Sri Lanka.
36757991,In vitro evaluation of dioscin and protodioscin against ER-positive and triple-negative breast cancer.
36757913,pH-/Redox-Responsive Nanodroplet Combined with Ultrasound-Targeted Microbubble Destruction for the Targeted Treatment of Drug-Resistant Triple Negative Breast Cancer.
36757900,Counselling of path_BRCA carriers who are considering risk-reducing oophorectomy.
36757899,Differential Protein Citrullination in Human ER- and ER+ Tumor and Adjacent Healthy Breast Tissue.
36757813,Stabilization of E-cadherin adhesions by COX-2/GSK3beta signaling is a targetable pathway in metastatic breast cancer.
36757707,Assessment of Phase 3 Randomized Clinical Trials Including Patients With Leptomeningeal Disease: A Systematic Review.
36757500,High-multiplex tissue imaging in routine pathology-are we there yet?
36757498,Association of sexual attitudes with sexual dysfunction and sexual distress among Chinese breast cancer survivors: a cross-sectional study.
36757143,Hypoxia-induced YAP activation and focal adhesion turnover to promote cell migration in mesenchymal TNBC cells.
36757139,HER2-low status may predict poor neoadjuvant chemotherapy response in HR-negative breast cancer: a real-world multicenter study.
36757135,Homologous repair deficiency-associated genes in invasive breast cancer revealed by WGCNA co-expression network analysis and genetic perturbation similarity analysis.
36757106,Functionalized Fluorescent Nanostructures Generated from Self-Assembly of a Cationic Tripeptide Direct Cell-Selective Chemotherapeutic Drug Delivery.
36757050,SAMD9 Promotes Postoperative Recurrence of Esophageal Squamous Cell Carcinoma by Stimulating MYH9-Mediated GSK3beta/beta-Catenin Signaling.
36757015,The pan-cancer analysis of the oncogenic role of FAM72A as a BRCA prognostic biomarker and immunotherapeutic target.
36756934,3D bioprinting of dECM/Gel/QCS/nHAp hybrid scaffolds laden with mesenchymal stem cell-derived exosomes to improve angiogenesis and osteogenesis.
36756852,Breast cancer-related mortality in Central and Eastern Europe: years of life lost and productivity costs.
36756775,"A consensus approach: Understanding the support needs of women in Newport West, Wales, to participate in breast screening."
36756767,"The roles of 68Ga-PSMA PET/CT and 18F-FDG PET/CT imaging in patients with triple-negative breast cancer and the association of tissue PSMA and claudin 1, 4, and 7 levels with PET findings."
36756721,"Isolation, Characterization and Anticancer Activity of Secondary Metabolites from Verbascum speciosum."
36756664,Screening for breast and cervical cancer among OST patients: a qualitative study of barriers and suggested interventions to increase participation.
36756591,Novel albumin-binding photodynamic agent EB-Ppa for targeted fluorescent imaging guided tumour photodynamic therapy.
36756447,"Design, synthesis, anticancer and in silico assessment of 8-caffeinyl-triazolylmethoxy hybrid conjugates."
36756380,ESGO/ESHRE/ESGE Guidelines for the fertility-sparing treatment of patients with endometrial carcinoma.
36756160,"Knowledge, attitudes, and behaviors toward fertility preservation in patients with breast cancer: A cross-sectional survey of physicians."
36756142,"Efficacy and safety results by menopausal status in monarchE: adjuvant abemaciclib combined with endocrine therapy in patients with HR+, HER2-, node-positive, high-risk early breast cancer."
36756105,Indian Data on HER2 Fluorescence In Situ Hybridization in Invasive Breast Cancer with Immunohistochemically Equivocal Results As Per 2018 ASCO/CAP Guidelines.
36756030,Her2 Status Discrepancy Between Core Needle Biopsy and Surgically Resected Mastectomy Specimen: A Clinical Case.
36756000,Breast to Brain: A Case Report and Literature Review of Leptomeningeal Carcinomatosis.
36755962,Correction to 'The DNA repair function of BCL11A suppresses senescence and promotes continued proliferation of triple-negative breast cancer cells'.
36755926,Obesity and endocrine-related cancer: The important role of IGF-1.
36755893,When Breast Cancer Survivorship Discourse Doesn't Work: Reflections From a Patient.
36755866,Integrating multi-type aberrations from DNA and RNA through dynamic mapping gene space for subtype-specific breast cancer driver discovery.
36755862,Reconstructive types effect the prognosis of patients with tumors in the central and nipple portion of breast cancer? An analysis based on SEER database.
36755860,Strategies for five tumour markers in the screening and diagnosis of female breast cancer.
36755853,High-resolution synthesis of high-density breast mammograms: Application to improved fairness in deep learning based mass detection.
36755810,Chromatin Regulator-Related Gene Signature for Predicting Prognosis and Immunotherapy Efficacy in Breast Cancer.
36755689,Assessment of Knowledge and Awareness About Breast Self-Examination Among University Female Students in Saudi Arabia.
36755606,S100A9 promotes glycolytic activity in HER2-positive breast cancer to induce immunosuppression in the tumour microenvironment.
36755605,Deep-learning based breast cancer detection for cross-staining histopathology images.
36755503,"[Peripheral neuropathy, onycholysis and health-related quality of life in womens with breast cancer treated with taxanes. Prospective longitudinal study.]"
36755294,Contralateral lymph node metastasis in recurrent ipsilateral breast cancer with Lynch syndrome: a locoregional event.
36755288,Tamoxifen induces radioresistance through NRF2-mediated metabolic reprogramming in breast cancer.
36755280,Evaluation and comparison of different breast cancer prognosis scores based on gene expression data.
36755259,CD1C is associated with breast cancer prognosis and immune infiltrates.
36755123,The profiles of miR-4510 expression level in breast cancer.
36755067,Cuproptosis: p53-regulated metabolic cell death?
36755057,METTL3 stabilization by PIN1 promotes breast tumorigenesis via enhanced m6A-dependent translation.
36754982,Targeting BAP1 with small compound inhibitor for colon cancer treatment.
36754981,Triphenylphosphonium conjugated gold nanotriangles impact Pi3K/AKT pathway in breast cancer cells: a photodynamic therapy approach.
36754946,The Absence of Cancer in the Location of a Breast Tissue Marker After Neoadjuvant Chemotherapy may Predict Pathological Complete Response with High Accuracy: Results from a Phase II Trial.
36754936,Contrast-enhanced mammography in the assessment of residual disease after neoadjuvant treatment.
36754932,YBX1/lncRNA SBF2-AS1 interaction regulates proliferation and tamoxifen sensitivity via PI3K/AKT/MTOR signaling in breast cancer cells.
36754246,Schwann cell-derived CXCL2 contributes to cancer pain by modulating macrophage infiltration in a mouse breast cancer model.
36754215,"Isopimaric acid, an ion channel regulator, regulates calcium and oxidative phosphorylation pathways to inhibit breast cancer proliferation and metastasis."
36754153,CRISPR/Cas genome editing in triple negative breast cancer: Current situation and future directions.
36754085,Hsa_circ_0001925 promotes malignant progression in triple-negative breast cancer via miR-1299/YY1 axis.
36754037,Impact of Geriatric Assessment on the Tolerability of Combination Chemotherapy in Older Patients with Advanced Cancer: A Matched-Pair Analysis.
36753992,Cancer burden in adolescents and young adults in Europe.
36753991,The impact of endoxifen-guided tamoxifen dose reductions on endocrine side-effects in patients with primary breast cancer.
36753987,"Synthesis, evaluation of anti-breast cancer activity in vitro of ICS II derivatives and summary of the structure-activity relationship."
36753973,"The interplay of arsenic, silymarin, and NF-kB pathway in male reproductive toxicity: A review."
36753971,Low-dose phthalates promote breast cancer stem cell properties via the oncogene DeltaNp63alpha and the Sonic hedgehog pathway.
36753965,"Exploring the cytotoxic effect and CDK-9 inhibition potential of novel sulfaguanidine-based azopyrazolidine-3,5-diones and 3,5-diaminoazopyrazoles."
36753964,Cationic lipid-conjugated bis-arylidene oxindole derivatives as broad-spectrum breast cancer-selective therapeutics.
36753957,Toward model-informed precision dosing for tamoxifen: A population-pharmacokinetic model with a continuous CYP2D6 activity scale.
36753952,"Phytoestrogens, novel dietary supplements for breast cancer."
36753768,Novel framework for determining TPS-calculated doses corresponding to detector locations using 3D camera in in-vivo surface dosimetry.
