PMID,Publication_Title
36788687,Programmed Cell Death Protein 1 (PD-1) in relation to PANoptosis: Immune Pharmacological Targets for Management of Breast Adenocarcinoma.
36788683,Longitudinal Association between L1 Trabecular Attenuation from Chest Computed Tomography (CT) and Bone Mineral Density from Dualenergy X-ray Absorptiometry (DXA).
36788681,Review on Computer Aided Breast Cancer Detection and Diagnosis Using Machine Learning Methods on Mammogram Image.
36788602,"Ultra-low-coverage genome-wide association study-insights into gestational age using 17,844 embryo samples with preimplantation genetic testing."
36788595,Diagnostic accuracy of a three-protein signature in women with suspicious breast lesions: a multicenter prospective trial.
36788408,Recent Advancements in Gremlin-1: Breast cancer.
36788391,Comprehensive targeted treatment options available for Breast cancer stem cells; A literature review of the last 10 years' developments.
36788310,Establishment and characterization of the first patient-derived radiation-induced angiosarcoma xenograft model (RT-AS5).
36788297,Investigation of Shared Genetic Risk Factors Between Parkinson's Disease and Cancers.
36788122,How Well Does Non-mass Enhancement Correlate With DCIS/Invasive Cancer?
36788100,The Role of Artificial Intelligence in Accurate Interpretation of HER2 Immunohistochemical Scores 0 and 1+ in Breast Cancer.
36788098,Homologous Recombination Repair Deficiency: An Overview for Pathologists.
36788086,"HER2-Low Breast Cancer: Incidence, Clinicopathologic Features, and Survival Outcomes From Real-World Data of a Large Nationwide Cohort."
36788082,Diagnostic Accuracy of GATA6 Immunostaining in Sebaceous Tumors of the Skin.
36788081,p53 Expression in Luminal Breast Cancer Correlates With TP53 Mutation and Primary Endocrine Resistance.
36788078,Early Triple-Negative Breast Cancers in a Singapore Cohort Exhibit High PIK3CA Mutation Rates Associated With Low PD-L1 Expression.
36788075,Lack of Standardization in the Diagnosis of Invasive Lobular Carcinoma of the Breast.
36788073,Identifying SOX17 as a Sensitive and Specific Marker for Ovarian and Endometrial Carcinomas.
36788069,Multi-institutional Assessment of Pathologist Scoring HER2 Immunohistochemistry.
36788064,Interobserver Variation in the Assessment of Immunohistochemistry Expression Levels in HER2-Negative Breast Cancer: Can We Improve the Identification of Low Levels of HER2 Expression by Adjusting the Criteria? An International Interobserver Study.
36787951,Serum concentrations of local anesthetics after unilateral interpectoral-pectoserratus plane block in breast cancer surgery: a pharmacokinetic study.
36787933,Electrochemotherapy with intravenous bleomycin for heavily pre-treated vulvar cancer patients.
36787921,Risks of mortality and severe coronavirus disease 19 (COVID-19) outcomes in patients with or without systemic lupus erythematosus.
36787863,E2F1-mediated ectopic expression of PP1A promotes breast cancer progression via activation of YAP1.
36787754,False-Positive Nodes With Axillary Silicone Lymphadenopathy in an Oncologic Patient With a Rare Breast Cancer and Implant Rupture.
36787669,HCTNet: A hybrid CNN-transformer network for breast ultrasound image segmentation.
36787617,Prognostic value of KI-67 proliferation index in luminal breast cancers.
36787613,Analisis del coste directo de la atencion medica y quirurgica del cancer de mama. Estudio comparativo entre etapas temprana y tardia en tercer nivel de atencion.
36787512,Improving Uptake of Cancer Genetic Risk Assessment in a Remote Tailored Risk Communication and Navigation Intervention: Large Effect Size but Room to Grow.
36787508,Molecular-Guided Off-Label Targeted Therapy in a Large-Scale Precision Oncology Program.
36787483,Impact of Acupuncture on Hot Flashes in Breast Cancer Patients Receiving Adjuvant Antiestrogen Therapy with Tamoxifen: A Randomized Controlled Trial.
36787427,Self-Generation of Distinguishable Fluorescent Probes via a One-Pot Process for Multiple MicroRNA Detection by Liquid Chromatography.
36787313,"Emotional, inflammatory, and genetic factors of resilience and vulnerability to depression in patients with premenopausal breast cancer: A longitudinal study protocol."
36787126,Understanding the role of access in Hispanic cancer screening disparities.
36787085,Integrative analyses of RNA-seq and ChIP-seq Reveal MITF as a Target Gene of TFPI-2 in MDA231 Cells.
36786996,Synergistic Effect of the Combined Action of Targeted and Photodynamic Therapy on HER2-Positive Breast Cancer.
36786946,Effects of preoperative magnetic resonance image on survival rates and surgical planning in breast cancer conservative surgery: randomized controlled trial (BREAST-MRI trial).
36786856,Communication between mothers with breast cancer and minor children: a qualitative systematic review and meta-synthesis.
36786674,Beyond Antiresorptive Activity: Risedronate-Based Coordination Complexes To Potentially Treat Osteolytic Metastases.
36786671,Dosimetric evaluation of the benefit of deep inspiration breath hold (DIBH) for locoregional irradiation of right breast cancer with volumetric modulated arctherapy (VMAT).
36786551,"Design, Synthesis, and Biological Activity of Marinacarboline Analogues as STAT3 Pathway Inhibitors for Docetaxel-Resistant Triple-Negative Breast Cancer."
36786527,MED27 plays a tumor-promoting role in breast cancer progression by targeting KLF4.
36786279,Sacituzumab govitecan expands its therapeutic spectrum among breast cancer subtypes.
36786196,Light Pareto robust optimization for IMRT treatment planning.
36786171,"Cancer referrals at African Inland Church Kijabe Hospital, Kiambu County (2014-2020) and the impact of COVID-19."
36785738,YB-1 Expression Is Associated with Lymph Node Metastasis and Drug Resistance to Adriamycin in Breast Cancer.
36785715,Association of Enolase-1 with Prognosis and Immune Infiltration in Breast Cancer by Clinical Stage.
36785707,A novel gene signature related to oxidative stress predicts the prognosis in clear cell renal cell carcinoma.
36785645,"The Practice and Willingness of Women Towards Opportunistic Screening for Breast and Cervical Cancers in Sichuan Province, China: A Cross-Sectional Study."
36785571,Ultralow Limit Detection of Soluble HER2 Biomarker in Serum with a Fiber-Optic Ball-Tip Resonator Assisted by a Tilted FBG.
36785489,"Mainstream genetic testing for high-grade ovarian, tubal and peritoneal cancers: A tertiary referral centre experience."
36782375,The activation of EP300 by F11R leads to EMT and acts as a prognostic factor in triple-negative breast cancers.
36782310,Biodegradable functionalized magnetite nanoparticles as binary-targeting carrier for breast carcinoma.
36782225,Role of breast cancer screening in the overdiagnosis of thyroid cancer: results from a cross-sectional nationwide survey.
36782224,DNA methylation in peripheral blood leukocytes for the association with glucose metabolism and invasive breast cancer.
36782197,LINC00478-derived novel cytoplasmic lncRNA LacRNA stabilizes PHB2 and suppresses breast cancer metastasis via repressing MYC targets.
36782134,Colorectal cancer survivors' long-term recollections of their illness and therapy up to seven years after enrolment into a randomised controlled clinical trial.
36782089,Phosphorylation of USP29 by CDK1 Governs TWIST1 Stability and Oncogenic Functions.
36781911,The association between shift work and the incidence of reflux esophagitis in Korea: a cohort study.
36781892,Ki67 increase after core needle biopsy associated with worse disease outcome in HER2-negative breast cancer patients.
36781869,Immunotherapy in breast cancer: an overview of current strategies and perspectives.
36781846,VPA mediates bidirectional regulation of cell cycle progression through the PPP2R2A-Chk1 signaling axis in response to HU.
36781812,Urban-Rural Disparity in Birth Cohort Effects on Breast Cancer Incidence.
36781808,Contrast-enhanced mammography (CEM) versus MRI for breast cancer staging: detection of additional malignant lesions not seen on conventional imaging.
36781754,Magnetic Thermosensitive Liposomes Loaded with Doxorubicin.
36781707,Effects of trastuzumab and trastuzumab emtansine on corrected QT interval and left ventricular ejection fraction in patients with metastatic (HER2+) breast cancer.
36781543,Receptive music therapy versus group music therapy with breast cancer patients hospitalized for surgery.
36781520,Neighborhood and racial influences on triple negative breast cancer: evidence from Northeast Ohio.
36781519,Comparison of goserelin and leuprorelin for ovarian protection during chemotherapy in young patients with breast cancer.
36781474,Tumor selective Ru(III) Schiff bases complexes with strong in vitro activity toward cisplatin-resistant MDA-MB-231 breast cancer cells.
36781387,Oncological surgery follow-up and quality of life: meta-analysis.
36781238,[Pathological features and immune microenvironment in HER-2 intratumoral heterogeneous breast cancers].
36781224,"Epidemiology and Risk Factors for Breast Cancer: 21st Century Advances, Gaps to Address through Interdisciplinary Science."
36781223,Human Ductal Carcinoma In Situ: Advances and Future Perspectives.
36781219,Newly Developed Targeted Therapies Against the Androgen Receptor in Triple-Negative Breast Cancer: A Review.
36781147,"Design, synthesis, and anti-triple negative breast cancer activity of novel Toosendanin derivatives."
36781026,Tamoxifen retinopathy.
36780963,Self-assembled nanocomposites of carboxymethyl beta-dextran/protamine sulfate for enhanced chemotherapeutic drug sensitivity of triple-negative breast cancer by autophagy inhibition via a ternary collaborative strategy.
36780904,Associations of Physical Activity With Breast Cancer Risk: Findings From the UK Biobank Prospective Cohort Study.
36780838,Cost-effectiveness of sacituzumab govitecan versus chemotherapy in advanced or metastatic triple-negative breast cancer.
36780800,Comprehensive landscape of the IPAF inflammasomes in pan-cancer: A bulk omics research and single-cell sequencing validation.
36780734,"G-CSF filgrastim biosimilar-Sandoz reduces the incidence of febrile neutropenia in patients receiving chemotherapy regimens with rest periods not exceeding 14 days: A French, multicenter, prospective, non-interventional study."
36780624,NAVIGATION SURGERY FOR INTRAOPERATIVE SENTINEL LYMPH NODE DETECTION USING ICG IN BREAST CANCER PATIENTS.
36780614,PATHOLOGIC FINDINGS IN GENDER-AFFIRMING MASTECTOMY: A SYSTEMATIC REVIEW.
36780610,US Food and Drug Administration Approval Summary: Fam-Trastuzumab Deruxtecan-nxki for Human Epidermal Growth Factor Receptor 2-Low Unresectable or Metastatic Breast Cancer.
36780587,Cognitive Problems in Older Breast Cancer Survivors.
36780531,An HLA-G/SPAG9/STAT3 axis promotes brain metastases.
36780467,"Year-end highlights in metastatic triple-negative breast cancer from the 2022 American Society of Clinical Oncology Annual Meeting, and the European Society for Medical Oncology Congress and Breast Cancer Congress."
36780460,Highlights in metastatic breast cancer from the 2022 San Antonio Breast Cancer Symposium.
36780448,Research Progress on Bioactive Metal Complexes against ER-Positive Advanced Breast Cancer.
36780426,Homologation of the Alkyl Side Chain of Antimitotic Phenyl 4-(2-Oxo-3-alkylimidazolidin-1-yl)benzenesulfonate Prodrugs Selectively Targeting CYP1A1-Expressing Breast Cancers Improves Their Stability in Rodent Liver Microsomes.
36780418,GLUT-Targeting Phototherapeutic Nanoparticles for Synergistic Triple Combination Cancer Therapy.
36780335,Pathways of the Dissociative Electron Attachment Observed in 5- and 6-Azidomethyluracil Nucleosides: Nitrogen (N2) Elimination vs Azide Anion (N3-) Elimination.
36780270,Piezocatalytic 2D WS2 Nanosheets for Ultrasound-Triggered and Mitochondria-Targeted Piezodynamic Cancer Therapy Synergized with Energy Metabolism-Targeted Chemotherapy.
36780234,Application of novel breast biospecimen cell type adjustment identifies shared DNA methylation alterations in breast tissue and milk with breast cancer risk factors.
36780232,Changes in breast cancer risk and risk factor profiles among U.S.-born and immigrant Asian American women residing in the San Francisco Bay Area.
36780214,An Adapted Cancer Screening Education Program for Native American Women With Intellectual and Developmental Disabilities and Their Caregivers: Protocol for Feasibility and Acceptability Testing.
36780065,"Open-source, fully-automated hybrid cardiac substructure segmentation: development and optimisation."
36779982,Socioeconomic Factors and Adherence to Health Care Recommendations in Adolescent and Young Adult Cancer Survivors.
36779961,Energy decomposition and waterswapping analysis to investigate the SNP associated DPD mediated 5-FU resistance.
36779863,A systematic review and multilevel regression analysis reveals the comorbidity prevalence in cancer.
36779764,Identification of target proteins for breast cancer genetic risk loci and blood risk biomarkers in a large study by integrating genomic and proteomic data.
36779542,Periodic Mesoporous Ionosilica Nanoparticles for BODIPY Delivery and Photochemical Internalization of siRNA.
36779378,Camptothecin loaded casein nanosystem for tuning the therapeutic efficacy against highly metastatic triple-negative breast cancer cells.
36779309,Participation in breast cancer screening and its influence on other cancer screening invitations: study in women aged 56 years old in four French departments.
36779253,Combined proliferation and apoptosis index provides better risk stratification in breast cancer.
36779121,Therapeutic Reduction Mammoplasty: Experience of a Single Institute.
36779118,Radiological Evaluation of a Malignant Gastrointestinal Stromal Tumor in a Female Patient With the Coincidental Detection of Primary Breast Cancer: A Case Report.
36779038,Malmo Breast ImaginG database: objectives and development.
36778984,Trends in Survival and Surgical Methods in Patients Surgically Treated for Metastatic Spinal Tumors: 25-Year Experience in a Single Institution.
36778924,Barriers and facilitators to provide multidisciplinary care for breast cancer patients in five Latin American countries: A descriptive-interpretative qualitative study.
36778795,Segmental thoracic spinal anesthesia versus general anesthesia for breast cancer surgery: A prospective randomized-controlled open-label trial.
36778756,"Causal Discovery in High-dimensional, Multicollinear Datasets."
36778735,Association between endocrine therapy and cognitive decline in breast cancer based on propensity score matching.
36778653,Pseudoangiomatous Stromal Hyperplasia: Radiologic-Pathologic Correlation.
36778652,Diagnostic Contrast-Enhanced Mammography Performed Immediately Prior to Same-Day Biopsy: An Analysis of Index Lesion Enhancement Compared to Histopathology and Follow-up in Patients With Suspicious Ultrasound Findings.
36778385,The lived experience of breast cancer patients on adjuvant endocrine therapy: Side effects and coping strategies during the first year of medication initiation.
36778377,"EstroGene database reveals diverse temporal, context-dependent and directional estrogen receptor regulomes in breast cancer."
36778343,Robust biomarker discovery through multiplatform multiplex image analysis of breast cancer clinical cohorts.
36778271,Identification and characterization of a proliferative cell population in estrogen receptor-positive metastatic breast cancer through spatial and single-cell transcriptomics.
36778256,Organoid generation from mouse mammary tumors captures the genetic heterogeneity of clinically relevant copy number alterations.
36778247,Arginine shortage induces replication stress and confers genotoxic resistance by inhibiting histone H4 translation and promoting PCNA polyubiquitination.
36778229,Single-cell RNA sequencing reveals dysregulated fibroblast subclusters in prurigo nodularis.
36778115,The FGFR1 Signaling Pathway Upregulates the Oncogenic Transcription Factor FOXQ1 to Promote Breast Cancer Cell Growth.
36778109,Erratum: A Long Non-coding RNA Lnc712 Regulates Breast Cancer Cell Proliferation: Erratum.
36778023,PAnno: A pharmacogenomics annotation tool for clinical genomic testing.
36777516,A novel PTEN mutant caused by polymorphism in cis-regulatory elements is involved in chemosensitivity in breast cancer.
36777514,Improved platform for breast cancer circulating tumor cell enrichment and characterization with next-generation sequencing technology.
36777513,Combined inhibition of PARP and ATR synergistically potentiates the antitumor activity of HER2-targeting antibody-drug conjugate in HER2-positive cancers.
36777506,An overview of the correlation between IPI and prognosis in primary breast lymphoma.
36777502,"Synergistic activity of ABT-263 and ONC201/TIC10 against solid tumor cell lines is associated with suppression of anti-apoptotic Mcl-1, BAG3, pAkt, and upregulation of pro-apoptotic Noxa and Bax cleavage during apoptosis."
36777384,Moderately hypofractionated radiation therapy for breast cancer: A Brazilian cohort study.
36777322,Cost containment analysis and access to treatment associated with adopting hypofractionated radiation therapy from the Brazilian perspective.
36777282,"Breast and Cervical cancer disparities in Alabama: current scenario, ongoing efforts to reduce the disparity gaps, and what more we could be doing."
36777230,Effects of dyadic-based physical activity intervention on cancer-related fatigue among cancer survivors: A scoping review.
36777188,Reconstructing mutational lineages in breast cancer by multi-patient-targeted single-cell DNA sequencing.
36776843,"By integrating single-cell RNA-seq and bulk RNA-seq in sphingolipid metabolism, CACYBP was identified as a potential therapeutic target in lung adenocarcinoma."
36776716,Association of CDH1 Germline Variants and Colon Polyp Phenotypes in Patients with Hereditary Diffuse Gastric Cancer.
36776542,Optimized Radiomics Nomogram Based on Automated Breast Ultrasound System: A Potential Tool for Preoperative Prediction of Metastatic Lymph Node Burden in Breast Cancer.
36776541,Factors Predicting Positive Sentinel Lymph Node Biopsy in Clinically Node-Negative Breast Cancer [Response to Letter].
36776368,Correlation between the Warburg effect and progression of triple-negative breast cancer.
36776359,"Libyan cancer patients at King Hussein Cancer Center for more than a decade, the current situation, and a future vision."
36776335,Bibliometric analysis of global research on physical activity and sedentary behavior in the context of cancer.
36776315,A nomogram based on combining clinical features and contrast enhanced ultrasound is not able to identify Her-2 over-expressing cancer from other breast cancers.
36776297,"Ovarian Real-World International Consortium (ORWIC): A multicentre, real-world analysis of epithelial ovarian cancer treatment and outcomes."
36776291,Cancer beliefs and screening behaviors: The impact of neighborhood and other social determinants of health.
36775971,Prognostic value of alkaline phosphatase and bone-specific alkaline phosphatase in breast cancer: A systematic review and meta-analysis.
36775863,Women's Metaphors About BRCA Gene Testing and How They Can Inform Health Communication Theory and Practice.
36775838,"Nimesulide, a COX-2 inhibitor, sensitizes pancreatic cancer cells to TRAIL-induced apoptosis by promoting DR5 clustering  ."
36761830,"Goji berry (Lycium barbarum) inhibits the proliferation, adhesion, and migration of oral cancer cells by inhibiting the ERK, AKT, and CyclinD cell signaling pathways: an in-vitro study."
36775765,Is Taxane Rechallenge Time Dependent in Patients With Advanced Triple-Negative Breast Cancer?
36775657,Molecular dynamics simulations reveal the effect of mutations in the RING domains of BRCA1-BARD1 complex and its relevance to the prognosis of breast cancer.
36775656,"Discovery of novel VEGFR2-TK inhibitors by phthalimide pharmacophore based virtual screening, molecular docking, MD simulation and DFT."
36775648,The synergistic effect of physical activity and nutrition to improve the quality of life in breast cancer patients: a systemic review.
36775449,Hedgehog blockade remodels the gut microbiota and the intestinal effector CD8+ T cells in a mouse model of mammary carcinoma.
36775354,"Quantitative assessment of Siglec-15 expression in lung, breast, head, and neck squamous cell carcinoma and bladder cancer."
36775350,Quantitative measurement of HER2 expression to subclassify ERBB2 unamplified breast cancer.
36775264,[Expert consensus on the diagnosis and treatment of young breast cancer in China (2022 Edition)].
36775260,In silico de novo drug design of a therapeutic peptide inhibitor against UBE2C in breast cancer.
36775221,Silver sulfide coated alginate radioenhancer for enhanced X-ray radiation therapy of breast cancer.
36775206,Maternal lifestyle and nutrient intakes during pregnancy and exclusive breastfeeding in relation to risk factors for breast cancer: The Japan Environment and Children's Study.
36775066,The impact of endocrine disrupting compounds and carcinogens in wastewater: Implications for breast cancer.
36774875,Capsaicin-loaded alginate nanoparticles embedded polycaprolactone-chitosan nanofibers as a controlled drug delivery nanoplatform for anticancer activity.
36774758,A review on the role of LINC00173 in human cancers.
36774756,Early breast cancer in women aged 35 years or younger: A large national multicenter French population-based case control-matched analysis.
36774698,"Design, synthesis, and discovery of Eudistomin Y derivatives as lysosome-targeted antiproliferation agents."
36774694,"Concordance of cancer drug therapy information derived from routinely collected hospital admissions data and the Systemic Anti-Cancer Therapy (SACT) dataset, for older women diagnosed with early invasive breast cancer in England."
36774644,Psychological distress and decision-making factors for prophylactic bilateral mastectomy in cancer-unaffected BRCA1/2 pathogenic variant carriers.
36774555,"Design, Synthesis, and Biological Evaluation of a Potent Dual EZH2-BRD4 Inhibitor for the Treatment of Some Solid Tumors."
36774447,Psychological impact of risk-stratified screening as part of the NHS Breast Screening Programme: multi-site non-randomised comparison of BC-Predict versus usual screening (NCT04359420).
36774408,Targeting the E3 ligase NEDD4 as a novel therapeutic strategy for IGF1 signal pathway-driven gastric cancer.
36774386,Epigenetic alterations impede epithelial-mesenchymal transition by modulating centrosome amplification and Myc/RAS axis in triple negative breast cancer cells.
36774357,Virtual elastography ultrasound via generative adversarial network for breast cancer diagnosis.
36774339,DNMT3a-dermatopontin axis suppresses breast cancer malignancy via inactivating YAP.
36774194,Racial and ethnic disparities in cervical and breast cancer screenings by nativity and length of U.S. residence.
36773967,The utilization of artificial intelligence applications to improve breast cancer detection and prognosis.
36773860,Folic-acid adorned alginate-polydopamine modified paclitaxel/Zn-CuO nanocomplex for pH triggered drug release and synergistic antitumor efficacy.
36773804,Human Cytochrome P450 17A1 Structures with Metabolites of Prostate Cancer Drug Abiraterone Reveal Substrate-Binding Plasticity and a Second Binding Site.
36773796,Cellular transformation promotes the incorporation of docosahexaenoic acid into the endolysosome-specific lipid bis(monoacylglycerol)phosphate in breast cancer.
36773567,MARCO is a potential prognostic and immunotherapy biomarker.
36773531,Amide proton transfer (APT) imaging of breast cancers and its correlation with biological status.
36773530,Preoperative localization of breast lesions: Comparing digital breast tomosynthesis-guided radioactive seed localization versus standard 2D stereotactic radioactive seed localization.
36773471,Intention matters: Success rate of bilateral salpingo-oophorectomy at the time of vaginal hysterectomy for pelvic organ prolapse.
36773404,A matched case-control study of the prognosis of early breast cancer in patients with Li-Fraumeni syndrome (BREAST TP53).
36773403,"Taxane rechallenge during metastatic disease in HER-2 negative breast cancer patients: Clinical activity, tolerance and survival results."
36773184,Estrogen therapy after breast cancer diagnosis and breast cancer mortality risk.
36773123,The Role of Attachment Styles on Quality of Life and Distress Among Early-Stage Female Breast Cancer Patients: A Systematic Review.
36773021,Cognitive function and breast cancer molecular subtype before and after chemotherapy.
36772982,Socioeconomic inequalities in waiting times for planned and cancer surgery: Evidence from Spain.
36772966,Therapeutic Role of Tamoxifen for Triple-Negative Breast Cancer: Leveraging the Interaction Between ERbeta and Mutant p53.
36772947,"Letter to the Editor From Wang et al.: ""Hormonal Crosstalk Between Thyroid and Breast Cancer""."
36772945,Dissecting the role of cancer-associated fibroblast-derived biglycan as a potential therapeutic target in immunotherapy resistance: A tumor bulk and single-cell transcriptomic study.
36772932,"Assessment of knowledge, understanding and awareness of Chinese women clinical staff towards menopause hormone therapy: a survey study."
36772889,Sodium thiosulfate as cisplatin otoprotectant in children: The challenge of when to use it.
36772881,Concentration QTc Analysis of Giredestrant: Overcoming QT/HR Confounding in the Presence of Drug-Induced Heart Rate Changes.
36772832,Feasibility and usability of a personalized mHealth app for self-management in the first year following breast cancer surgery.
