PMID,Publication_Title
36772804,"Chemical composition and anticancer activity of the essential oil from Vicia ochroleuca Ten., quite rare plant in Kabylia (Algeria)."
36772795,Differential contractility regulates cancer stem cell migration.
36772592,A Two-Step Feature Selection Radiomic Approach to Predict Molecular Outcomes in Breast Cancer.
36772536,Evaluating the Performance of Algorithms in Axillary Microwave Imaging towards Improved Breast Cancer Staging.
36772473,A Comprehensive Landscape of Imaging Feature-Associated RNA Expression Profiles in Human Breast Tissue.
36772091,Design of Ultra-Wideband Phased Array Applicator for Breast Cancer Hyperthermia Therapy.
36771614,The Antioxidant and Proapoptotic Effects of Sternbergia clusiana Bulb Ethanolic Extract on Triple-Negative and Estrogen-Dependent Breast Cancer Cells In Vitro.
36771391,Chemical Characterization of Honey and Its Effect (Alone as well as with Synthesized Silver Nanoparticles) on Microbial Pathogens' and Human Cancer Cell Lines' Growth.
36771385,Carrot Intake and Risk of Developing Cancer: A Prospective Cohort Study.
36771239,Intermittent Fasting in Breast Cancer: A Systematic Review and Critical Update of Available Studies.
36771230,Narrow Leafed Lupin (Lupinus angustifolius L.) beta-Conglutin Seed Proteins as a New Natural Cytotoxic Agents against Breast Cancer Cells.
36771161,A Review of Different Types of Liposomes and Their Advancements as a Form of Gene Therapy Treatment for Breast Cancer.
36771126,"Towards Developing Novel Prostate Cancer Recurrence Suppressors: Acute Toxicity of Pseurotin A, an Orally Active PCSK9 Axis-Targeting Small-Molecule in Swiss Albino Mice."
36771106,Mushroom-Derived Compounds as Metabolic Modulators in Cancer.
36771058,Folic Acid Functionalized Diallyl Trisulfide-Solid Lipid Nanoparticles for Targeting Triple Negative Breast Cancer.
36771032,"Ulvophyte Green Algae Caulerpa lentillifera: Metabolites Profile and Antioxidant, Anticancer, Anti-Obesity, and In Vitro Cytotoxicity Properties."
36770957,Impact of Ag/ZnO Reinforcements on the Anticancer and Biological Performances of CA@Ag/ZnO Nanocomposite Materials.
36770951,Studies on the Complexation of Platinum(II) by Some 4-Nitroisoxazoles and Testing the Cytotoxic Activity of the Resulting Complexes.
36770881,Biosynthesized Silver Nanoparticles Using Morus alba (White Mulberry) Leaf Extract as Potential Antibacterial and Anticancer Agents.
36770864,Bioactive Clerodane Diterpenoids from the Leaves of Casearia coriacea Vent.
36770830,Ferritin-Coated SPIONs as New Cancer Cell Targeted Magnetic Nanocarrier.
36770785,"In Silico Study on the Interactions, Molecular Docking, Dynamics and Simulation of Potential Compounds from Withania somnifera (L.) Dunal Root against Cancer by Targeting KAT6A."
36770781,Icaritin Derivative IC2 Induces Cytoprotective Autophagy of Breast Cancer Cells via SCD1 Inhibition.
36770598,Wnt Signaling Pathway Collapse upon beta-Catenin Destruction by a Novel Antimicrobial Peptide SKACP003: Unveiling the Molecular Mechanism and Genetic Activities Using Breast Cancer Cell Lines.
36770518,"The Cytotoxicity of Carbon Nanotubes and Hydroxyapatite, and Graphene and Hydroxyapatite Nanocomposites against Breast Cancer Cells."
36770357,3D AFM Nanomechanical Characterization of Biological Materials.
36769814,"Does the Pathologic Fracture Predict Severe Paralysis in Patients with Metastatic Epidural Spinal Cord Compression (MESCC)?-A Retrospective, Single-Center Cohort Analysis."
36769616,State of the Art in 2022 PET/CT in Breast Cancer: A Review.
36769602,Predictive Biomarkers for Response to Immunotherapy in Triple Negative Breast Cancer: Promises and Challenges.
36769509,Robustness of Breast Margins with Volumetric Modulated Arc Therapy without a Six-Degrees-of-Freedom Couch: A Dosimetric Evaluation.
36769386,Long-Term Results after Autologous Breast Reconstruction with DIEP versus PAP Flaps Based on Quality of Life and Aesthetic Outcome Analysis.
36769287,Triple-Negative Breast Cancer and Predictive Markers of Response to Neoadjuvant Chemotherapy: A Systematic Review.
36769280,Ubiquitin-Related Modifier 1 (URM-1) Modulates Cx43 in Breast Cancer Cell Lines.
36769274,"Targets Involved in the Anti-Cancer Activity of Quercetin in Breast, Colorectal and Liver Neoplasms."
36769251,"The Association of Integrins beta3, beta4, and alphaVbeta5 on Exosomes, CTCs and Tumor Cells with Localization of Distant Metastasis in Breast Cancer Patients."
36769215,Characterization of Hormone Receptor and HER2 Status in Breast Cancer Using Mass Spectrometry Imaging.
36769210,Evolution of Antiretroviral Drug Rilpivirine and Approach to Oncology.
36769184,Expression of RBMS3 in Breast Cancer Progression.
36769177,Harnessing the LdCsm RNA Detection Platform for Efficient microRNA Detection.
36769125,The Orphan GPR50 Receptor Regulates the Aggressiveness of Breast Cancer Stem-like Cells via Targeting the NF-kB Signaling Pathway.
36769029,Health Benefits of Coffee Consumption for Cancer and Other Diseases and Mechanisms of Action.
36768939,MicroRNA and Messenger RNA Expression Profiles in Canine Mammary Gland Tumor.
36768923,Reactivity Graph Yields Interpretable IgM Repertoire Signatures as Potential Tumor Biomarkers.
36768866,Breast Cancer: From Pathophysiology to Novel Therapeutic Approaches 2.0.
36768848,IRAK2 Downregulation in Triple-Negative Breast Cancer Cells Decreases Cellular Growth In Vitro and Delays Tumour Progression in Murine Models.
36768838,GRHL2 Regulation of Growth/Motility Balance in Luminal versus Basal Breast Cancer.
36768830,VT68.2: An Antibody to Chondroitin Sulfate Proteoglycan 4 (CSPG4) Displays Reactivity against a Tumor-Associated Carbohydrate Antigen.
36768815,"""Pulsed Hypoxia"" Gradually Reprograms Breast Cancer Fibroblasts into Pro-Tumorigenic Cells via Mesenchymal-Epithelial Transition."
36768694,Targeting the Retinoic Acid Pathway to Eradicate Cancer Stem Cells.
36768647,Effective or Harmful-Evaluation of Locally Applied Antibiotics on Adipose Tissue during Lipofilling to the Breast-An In Vitro Study.
36768623,Detection of Circulating Tumor Cell-Related Markers in Gynecologic Cancer Using Microfluidic Devices: A Pilot Study.
36768568,Exploring the Biological Properties of Zn(II) Bisthiosemicarbazone Helicates.
36768478,Expression of CD22 in Triple-Negative Breast Cancer: A Novel Prognostic Biomarker and Potential Target for CAR Therapy.
36768470,Resveratrol Analogs and Prodrugs Differently Affect the Survival of Breast Cancer Cells Impairing Estrogen/Estrogen Receptor alpha/Neuroglobin Pathway.
36768435,Proteins Found in the Triple-Negative Breast Cancer Secretome and Their Therapeutic Potential.
36768427,The Critical Impact of Sphingolipid Metabolism in Breast Cancer Progression and Drug Response.
36768363,"The Effect of Silica Nanoparticles (SiNPs) on Cytotoxicity, Induction of Oxidative Stress and Apoptosis in Breast Cancer Cell Lines."
36768298,The Role of Different Types of microRNA in the Pathogenesis of Breast and Prostate Cancer.
36768191,Discrimination between Complete versus Non-Complete Pathologic Response to Neoadjuvant Therapy Using Ultrasensitive Mutation Analysis: A Proof-of-Concept Study in BRCA1-Driven Breast Cancer Patients.
36768147,"Association of the Telomerase Reverse Transcriptase rs10069690 Polymorphism with the Risk, Age at Onset and Prognosis of Triple Negative Breast Cancer."
36768046,Association between Poverty and Refraining from Seeking Medical Care during the COVID-19 Pandemic in Japan: A Prospective Cohort Study.
36767928,"Safety of Combined Targeted and Helixor Viscum album L. Therapy in Breast and Gynecological Cancer Patients, a Real-World Data Study."
36767461,Comparison of Single Target-Controlled Infusion Pump-Delivered Mixed Propofol and Remifentanil with Two Target-Controlled Infusion Pumps-Delivered Propofol and Remifentanil in Patients Undergoing Breast Cancer Surgery-A Prospective Study.
36767318,Multivariate Pharma Technology Transfer Analysis: Civilization Diseases and COVID-19 Perspective.
36767117,Encouraging and Reinforcing Safe Breastfeeding Practices during the COVID-19 Pandemic.
36767078,Gauging the Changing Landscape: Telehealth Perceptions among Hispanic Females with Breast Cancer.
36767073,Quality of Life and Side Effects Management in Cancer Treatment-A Cross Sectional Study.
36767056,Coping Self-Efficacy and Its Relationship with Psychological Morbidity after Genetic Test Result Disclosure: Results from Cancer-Unaffected BRCA1/2 Mutation Carriers.
36767006,Framework for Adoption of Next-Generation Sequencing (NGS) Globally in the Oncology Area.
36766992,Use of Ultrasound and Ki-67 Proliferation Index to Predict Breast Cancer Tumor Response to Neoadjuvant Endocrine Therapy.
36766923,Understanding Patient Experience with Outpatient Cancer Rehabilitation Care.
36766907,Patients' Perspectives of Interprofessional Collaboration in Breast Cancer Unit.
36766896,Metformin Therapy and Breast Cancer Incidence in the Ha'il Region.
36766893,Cancer of the Cervix in Bulgaria: Epidemiology of a Crisis.
36766858,The Effects of the Ukrainian Conflict on Oncological Care: The Latest State of the Art.
36766793,Ultrastructural Analysis of Cancer Cells Treated with the Radiopharmaceutical Radium Dichloride ([223Ra]RaCl2): Understanding the Effect on Cell Structure.
36766786,RUNX1 Is Regulated by Androgen Receptor to Promote Cancer Stem Markers and Chemotherapy Resistance in Triple Negative Breast Cancer.
36766734,Light-Enhanced Cytotoxicity of Doxorubicin by Photoactivation.
36766731,Transcriptomic and Functional Evidence That miRNA193a-3p Inhibits Lymphatic Endothelial Cell (LEC) and LEC + MCF-7 Spheroid Growth Directly and by Altering MCF-7 Secretome.
36766710,"Systemically Identifying Triple-Negative Breast Cancer Subtype-Specific Prognosis Signatures, Based on Single-Cell RNA-Seq Data."
36766681,A Medical Image Segmentation Method Based on Improved UNet 3+ Network.
36766645,"A Novel Nomogram Based on Imaging Biomarkers of Shear Wave Elastography, Angio Planewave Ultrasensitive Imaging, and Conventional Ultrasound for Preoperative Prediction of Malignancy in Patients with Breast Lesions."
36766641,A Systematic Review of Application Progress on Machine Learning-Based Natural Language Processing in Breast Cancer over the Past 5 Years.
36766617,Diagnostic Usefulness of Diffusion-Weighted MRI for Axillary Lymph Node Evaluation in Patients with Breast Cancer.
36766575,Clinical Evidence of Circulating Tumor DNA Application in Aggressive Breast Cancer.
36766541,Classifying Breast Cancer Metastasis Based on Imaging of Tumor Primary and Tumor Biology.
36766517,Optimized S-Curve Transformation and Wavelets-Based Fusion for Contrast Elevation of Breast Tomograms and Mammograms.
36766486,"Expression of the Immunohistochemical Markers CK5, CD117, and EGFR in Molecular Subtypes of Breast Cancer Correlated with Prognosis."
36766484,Contribution of Outpatient Ultrasound Transvaginal Biopsy and Puncture in the Diagnosis and Treatment of Pelvic Lesions: A Bicenter Study.
36766472,Prone versus Supine FDG PET/CT in the Staging of Breast Cancer.
36766453,A Novel Medical Image Enhancement Algorithm for Breast Cancer Detection on Mammography Images Using Machine Learning.
36766450,Development of an Artificial Intelligence-Based Breast Cancer Detection Model by Combining Mammograms and Medical Health Records.
36766292,Proof-of-Concept Study of an Alpha-Fetoprotein-Derived Peptide for the Management of Canine Mammary Cancer.
36765925,"Enhancer Clusters Drive Type I Interferon-Induced TRAIL Overexpression in Cancer, and Its Intracellular Protein Accumulation Fails to Induce Apoptosis."
36765923,CDK4/6 Inhibitors in Pancreatobiliary Cancers: Opportunities and Challenges.
36765921,Prediction of the Malignancy of a Breast Lesion Detected on Breast Ultrasound: Radiomics Applied to Clinical Practice.
36765912,Changes in Expression of Tumor Suppressor Gene RKIP Impact How Cancers Interact with Their Complex Environment.
36765902,Genomic Prostate Score: A New Tool to Assess Prognosis and Optimize Radiation Therapy Volumes and ADT in Intermediate-Risk Prostate Cancer.
36765900,Computational Pathology for Breast Cancer and Gynecologic Cancer.
36765888,"2,2-Diphenethyl Isothiocyanate Enhances Topoisomerase Inhibitor-Induced Cell Death and Suppresses Multi-Drug Resistance 1 in Breast Cancer Cells."
36765887,Traffic-Related Air Pollution and Breast Cancer Risk: A Systematic Review and Meta-Analysis of Observational Studies.
36765876,Impact of Surgical Care Bundle on Surgical Site Infection after Non-Reconstructive Breast Cancer Surgery: A Single-Centre Retrospective Comparative Cohort Study.
36765870,Tumour Growth Models of Breast Cancer for Evaluating Early Detection-A Summary and a Simulation Study.
36765866,PET/CT with Fibroblast Activation Protein Inhibitors in Breast Cancer: Diagnostic and Theranostic Application-A Literature Review.
36765860,"The Rochester Modified Magee Algorithm (RoMMa): An Outcomes Based Strategy for Clinical Risk-Assessment and Risk-Stratification in ER Positive, HER2 Negative Breast Cancer Patients Being Considered for Oncotype DX  Testing."
36765853,Exosome-Transmitted tRF-16-K8J7K1B Promotes Tamoxifen Resistance by Reducing Drug-Induced Cell Apoptosis in Breast Cancer.
36765851,Response to Ovarian Stimulation for Urgent Fertility Preservation before Gonadotoxic Treatment in BRCA-Pathogenic-Variant-Positive Breast Cancer Patients.
36765843,Elevation of Cytoplasmic Calcium Suppresses Microtentacle Formation and Function in Breast Tumor Cells.
36765839,Hyperparameter Optimizer with Deep Learning-Based Decision-Support Systems for Histopathological Breast Cancer Diagnosis.
36765831,Facilitating Factors and Barriers in the Return to Work of Working Women Survivors of Breast Cancer: A Qualitative Study.
36765796,Deep Learning with Transformer or Convolutional Neural Network in the Assessment of Tumor-Infiltrating Lymphocytes (TILs) in Breast Cancer Based on US Images: A Dual-Center Retrospective Study.
36765786,Factors Influencing Residual Glandular Breast Tissue after Risk-Reducing Mastectomy in Genetically Predisposed Individuals Detected by MRI Mammography.
36765782,"MicroRNAs with Multiple Targets of Immune Checkpoints, as a Potential Sensitizer for Immune Checkpoint Inhibitors in Breast Cancer Treatment."
36765778,The Omega-3 Docosahexaenoyl Ethanolamide Reduces CCL5 Secretion in Triple Negative Breast Cancer Cells Affecting Tumor Progression and Macrophage Recruitment.
36765776,Implementing HRD Testing in Routine Clinical Practice on Patients with Primary High-Grade Advanced Ovarian Cancer.
36765765,"The Evolution of Ki-67 and Breast Carcinoma: Past Observations, Present Directions, and Future Considerations."
36765724,Tumor Infiltrating Lymphocytes across Breast Cancer Subtypes: Current Issues for Biomarker Assessment.
36765720,HER2 and BARD1 Polymorphisms in Early HER2-Positive Breast Cancer Patients: Relationship with Response to Neoadjuvant Anti-HER2 Treatment.
36765717,Potent Inhibition of Macropinocytosis by Niclosamide in Cancer Cells: A Novel Mechanism for the Anticancer Efficacy for the Antihelminthic.
36765715,"Innate Immune Program in Formation of Tumor-Initiating Cells from Cells-of-Origin of Breast, Prostate, and Ovarian Cancers."
36765709,CANTO-RT: One of the Largest Prospective Multicenter Cohort of Early Breast Cancer Patients Treated with Radiotherapy including Full DICOM RT Data.
36765699,Combined Hyperthermia and Re-Irradiation in Non-Breast Cancer Patients: A Systematic Review.
36765690,Sialyl LewisX/A and Cytokeratin Crosstalk in Triple Negative Breast Cancer.
36765683,Cancer-Associated Adipocytes and Breast Cancer: Intertwining in the Tumor Microenvironment and Challenges for Cancer Therapy.
36765667,A Suggested Modification to FIGO Stage IV Epithelial Ovarian Cancer.
36765666,Long-Term Non-Cancer Risks in People with BRCA Mutations following Risk-Reducing Bilateral Salpingo-Oophorectomy and the Role of Hormone Replacement Therapy: A Review.
36765654,Insights of Platinum Drug Interaction with Spinel Magnetic Nanocomposites for Targeted Anti-Cancer Effect.
36765651,Quantitative Assessment of Treatment Response in Metastatic Breast Cancer Patients by SPECT-CT Bone Imaging-Getting Closer to PET-CT.
36765650,Use of Nonsteroidal Anti-Inflammatory Drugs and Risk of Breast Cancer: Evidence from a General Female Population and a Mammographic Screening Cohort in Sweden.
36765648,Safety and Feasibility of Radiation Therapy Combined with CDK 4/6 Inhibitors in the Management of Advanced Breast Cancer.
36765642,Breast Cancer Prediction Using Fine Needle Aspiration Features and Upsampling with Supervised Machine Learning.
36765634,Peripubertal Nutritional Prevention of Cancer-Associated Gene Expression and Phenotypes.
36765631,Plasma Cytokines/Chemokines as Predictive Biomarkers for Lymphedema in Breast Cancer Patients.
36765604,Novel Non-Cyclooxygenase Inhibitory Derivative of Sulindac Inhibits Breast Cancer Cell Growth In Vitro and Reduces Mammary Tumorigenesis in Rats.
36765602,An Optimized Single Nucleotide Polymorphism-Based Detection Method Suggests That Allelic Variants in the 3' Untranslated Region of RRAS2 Correlate with Treatment Response in Chronic Lymphocytic Leukemia Patients.
36765598,The Relationship between Cancer and Dementia: An Updated Review.
36765592,Applying Explainable Machine Learning Models for Detection of Breast Cancer Lymph Node Metastasis in Patients Eligible for Neoadjuvant Treatment.
36765571,Salvage Perioperative Interstitial High-Dose-Rate Interventional Radiotherapy (Brachytherapy) for Local Recurrences of the Chest Wall Following Mastectomy and Previous External Irradiation.
36765561,Barriers to Breast Cancer-Screening Adherence in Vulnerable Populations.
36765559,Prognostic Implications of the Residual Tumor Microenvironment after Neoadjuvant Chemotherapy in Triple-Negative Breast Cancer Patients without Pathological Complete Response.
36765550,"Breast Cancer Survivors and Healthy Women: Could Gut Microbiota Make a Difference?-""BiotaCancerSurvivors"": A Case-Control Study."
36765538,Intraoperative Evaluation of Soft Tissue Sarcoma Surgical Margins with Indocyanine Green Fluorescence Imaging.
36765535,The Influence of the Normal Mammary Microenvironment on Breast Cancer Cells.
36765529,Doxycycline-Induced Changes in Circulating MMP or TIMP2 Levels Are Not Associated with Skeletal-Related Event-Free or Overall Survival in Patients with Bone Metastases from Breast Cancer.
36765527,Multi-Parameter Analysis of Disseminated Tumor Cells (DTCs) in Early Breast Cancer Patients with Hormone-Receptor-Positive Tumors.
36765523,Standardising Breast Radiotherapy Structure Naming Conventions: A Machine Learning Approach.
36765522,Immunotherapy: Review of the Existing Evidence and Challenges in Breast Cancer.
36765432,The Michigan Genetic Hereditary Testing (MiGHT) study's innovative approaches to promote uptake of clinical genetic testing among cancer patients: a study protocol for a 3-arm randomized controlled trial.
36765430,Cellular senescence in the response of HR+ breast cancer to radiotherapy and CDK4/6 inhibitors.
36765409,"The various role of microRNAs in breast cancer angiogenesis, with a special focus on novel miRNA-based delivery strategies."
36765408,Risks of second non-breast primaries following breast cancer in women: a systematic review and meta-analysis.
36765397,METTL3 depletion contributes to tumour progression and drug resistance via N6 methyladenosine-dependent mechanism in HR+HER2-breast cancer.
36765355,A large single-center prospective study to investigate the factors influencing the choice of breast-conserving surgery versus mastectomy in Chinese women with early breast cancer.
36765293,Efficacy of subsequent treatments in patients with hormone-positive advanced breast cancer who had disease progression under CDK 4/6 inhibitor therapy.
36765275,GDNF-RET signaling and EGR1 form a positive feedback loop that promotes tamoxifen resistance via cyclin D1.
36765265,Multi-responsive chitosan-based hydrogels for controlled release of vincristine.
36765262,Integrative competing endogenous RNA network analyses identify novel lncRNA and genes implicated in metastatic breast cancer.
36765174,Tumour-educated platelets for breast cancer detection: biological and technical insights.
36765172,Tamoxifen evolution.
36765154,Prevalence and trends of perioperative major adverse cardiovascular and cerebrovascular events during cancer surgeries.
36765007,ASO Author Reflections: How Can We Eliminate Breast Surgery in Patients Who Achieved Clinical Complete Response After Neoadjuvant Chemotherapy?
36764934,Invited Discussion on: Palpable Nodules after Autologous Fat Grafting in Breast Cancer Patients: Incidence and Impact on Follow-up.
36764880,Clinical utility of axillary nodal markers in breast cancer.
36764879,Clinical Outcomes of Conservative Treatment for Low-Risk Ductal Carcinoma in Situ: A Systematic Review and Pooled Analysis.
36764877,The Association Between Survival and Receipt of Post-mastectomy Radiotherapy According to Age at Diagnosis Among Women With Early Invasive Breast Cancer: A Population-Based Cohort Study.
36764873,Circ_0108942 Regulates the Progression of Breast Cancer by Regulating the MiR-1178-3p/TMED3 Axis.
36764772,A universal and sensitive gene mutation detection method based on CRISPR-Cas12a.
36764734,Right breast ulceration and dystrophic calcification as a late sequela following postmastectomy radiotherapy.
36764493,M6A-mediated upregulation of FZD10 regulates liver cancer stem cells properties and lenvatinib resistance through WNT/beta-catenin and Hippo signaling pathways.
36764447,Contemporary Treatment Outcome of Metastases to the Pituitary Gland.
36764414,Development of Thiol-Maleimide hydrogels incorporating graphene-based nanomaterials for cancer chemo-photothermal therapy.
36764231,"Imidazo[1,2-a]quinazolines as novel, potent EGFR-TK inhibitors: Design, synthesis, bioactivity evaluation, and in silico studies."
36764134,Comparison of tumor-derived total RNA and cell lysate on antitumor immune activity.
36764127,Graphene-based 3D-Printed nanocomposite bioelectronics for monitoring breast cancer cell adhesion.
36764122,Discovery of unglycosylated indolocarbazoles as ROCK2 isoform-selective inhibitors for the treatment of breast cancer metastasis.
36764093,Targeting HER3 for cancer treatment: a new horizon for an old target.
36764040,Pre-operative Radiotherapy And Deep Inferior Epigastric Artery Perforator (DIEP) flAp study (PRADA): Aesthetic outcome and patient satisfaction at one year.
36764019,The influence of axillary surgery and radiotherapeutic strategy on the risk of lymphedema and upper extremity dysfunction in early breast cancer patients.
36763623,Attitude sustains longer than subjective norm and perceived behavioral control: Results of breast cancer screening educational intervention.
36763611,Exploring the Roles of Patient Advocates in Integrative Oncology.
36763585,Neoadjuvant chemotherapy modulates exhaustion of T cells in breast cancer patients.
36763552,[Expression of estrogen and progesterone receptors in vestibular schwannomas].
36763359,Effect of Fractional Carbon Dioxide vs Sham Laser on Sexual Function in Survivors of Breast Cancer Receiving Aromatase Inhibitors for Genitourinary Syndrome of Menopause: The LIGHT Randomized Clinical Trial.
36763315,Clinical utility of abbreviated breast MRI based on diffusion tensor imaging in patients underwent breast conservative therapy.
36763205,Correction: PARP targeted Auger emitter therapy with [125I]PARPi-01 for triple-negative breast cancer.
36763193,Evaluation of optimal monoenergetic images acquired by dual-energy CT in the diagnosis of T staging of thoracic esophageal cancer.
36763188,Effect of acupuncture in myelosuppression and quality of life in women with breast cancer undergoing chemotherapy: a randomized clinical study.
36763142,Chromosomal radiosensitivity of human breast carcinoma cells and blood lymphocytes following photon and proton exposures.
36763051,Characterization of Oxygen Nanobubbles and In Vitro Evaluation of Retinal Cells in Hypoxia.
36763035,Potential Antihuman Epidermal Growth Factor Receptor 2 Target Therapy Beneficiaries: The Role of MRI-Based Radiomics in Distinguishing Human Epidermal Growth Factor Receptor 2-Low Status of Breast Cancer.
36762843,Re: Clinicopathological Features and Outcomes Comparing Patients With Invasive Ductal and Lobular Breast Cancer.
36762832,Toxicity Risk Score and Clinical Decline After Adjuvant Chemotherapy in Older Breast Cancer Survivors.
36762811,Breast Cancer to Meningioma: A Rare Case of Tumor-to-Tumor Metastasis.
36762803,Molecular Biology of Brain Metastases.
36762785,"Biomarkers That Predict an Unclear Benefit From Adjuvant Trastuzumab, Pertuzumab and Pembrolizumab When Those Same Drugs Were Given Neoadjuvantly."
36762784,Canine as a Comparative and Translational Model for Human Mammary Tumor.
36762783,Aspirin Use Is Associated With Improved Outcomes in Inflammatory Breast Cancer Patients.
36762782,"Treatment of Breast Cancer-Related Lymphedema With Topical Tacrolimus: A Prospective, Open-Label, Single-Arm, Phase II Pilot Trial."
36762781,AKR1C2 Promotes Metastasis and Regulates the Molecular Features of Luminal Androgen Receptor Subtype in Triple Negative Breast Cancer Cells.
36762686,"New tamoxifen analogs for breast cancer therapy: synthesis, aromatase inhibition and in silico studies."
36762663,The effect of immediate lymphatic reconstruction on the post-operative drain output after axillary lymph node dissection for breast cancer: A retrospective comparative study.
36762576,"Challenging breast cancer through novel sulfonamide-pyridine hybrids: design, synthesis, carbonic anhydrase IX inhibition and induction of apoptosis."
